{
  "schemaVersion": 2,
  "subjectId": "example-algebra",
  "chapterId": "example-ch01",
  "title": "Subspaces",
  "source": {
    "kind": "author",
    "originalFile": "example-authored.txt",
    "originalSha256": "184d4b8c9cc300c83e55ecc5d377106482bba87783d5c380aa37327473f9d717"
  },
  "content": [
    {
      "type": "block",
      "id": "example-context",
      "format": "markdown",
      "text": "Let $V$ be a vector space over $F$. All subspaces use the same scalar field."
    },
    {
      "type": "section",
      "id": "example-definitions",
      "title": "Definitions",
      "label": "1",
      "content": [
        {
          "type": "item",
          "id": "example-subspace",
          "kind": "definition",
          "label": "1.1",
          "content": [
            {
              "type": "block",
              "id": "example-subspace-body",
              "format": "markdown",
              "text": "A subset $U$ of $V$ is a subspace when $U$ is a vector space with the same addition and scalar multiplication as $V$."
            }
          ],
          "learning": {
            "capabilities": [
              "recognize",
              "apply"
            ],
            "requires": [],
            "proofCoverage": "none"
          }
        }
      ]
    }
  ]
}
